{
  "type": "fabric-machine-report/1",
  "kem": "m-hub#kem",
  "enc": "BBr5XNygqB0EqqKuD6gqCL60xzeLChRRSTHAnbKkUkEA8aVl1ZRyt1xalCaRPJOkuHlKf2R0hfnczCur1F1el6U",
  "ct": "BXcr0pdRsKsyILRqcCgRL8DnO5USPE3ARMAZcepC96-FYasgn312wncaDok88cbx4hCHXacf_s-QcDLnAADm605aQo6_4_nC9P4HhxqS-34rBeRFMIMdCuT6eR05fMm5iTR-GM_XIkGE9EB-8cSWNzrinv1G42pni6nZB_tr3laZ5GRahJ6b7zJ0sCPOHMQNoYkUkze6ixc-gAIbomKtshuOl7cPDzLJ77Am_1a34baOQ5JI8JqHHCmZ7qau0bb-wwuQ37KzgBU6tegZNpO4nloyJ6ca3Z-xQXS_Ee9IEXzA9LqRsinCcYtYvvg1vfeObepNkyi32Z2c_n-C6slfsb4KObudha7VIJCnvdfQIemyyCYvlJj3DxpqxmHwyedx0AtStcDUpSQXHq3DnstL7pdn-Ozr0Ljb9wgMu2aI-i8VVBtSgIY4OBjx6SyCkoGE5KkHkC_BOZp2Bx6f7t7AmlyS9cz5G3rv6upLcdPaR2X1APaB5EZ-H-sSUDFQpktxTr7JWmWJ9ZfW74ACE3cQm_7TbYE4Iv7of_LDK2tZvPqfWYrR_hNY0pBjxx2a3CGEREWMFTgPbvoXCXJVV93DetcoyHzjSLKSptWtaw"
}
